Id_house;name;blazon;motto;followers;exist;Id_kingdom
637;Гиблерры;Кошка на Бледный желто-розовом фоне;Мы живет Утка;84;False;11
638;Санкионы;Оливковое дерево на Бледный желто-розовом фоне;Громкие есть Конь;550;True;20
639;Краливоны;Бабочка на Бледно-зелено-сером фоне;Долг живет Кошка;597;True;9
640;Блэкдравеи;Пальма на Вересково-фиолетовом фоне;Тихие  Лев;318;True;25
641;Блэкдрары;Грач на Белоснежном фоне;Мы  Лебедь;582;True;4
642;Хоаномоны;Лань на Бледно-пурпурном фоне;Честь живет Конь;944;True;2
643;Гибвеи;Медведь на Амарантовом фоне;Мы не Бабочка;900;False;21
644;Фицвыслоу;Пчела на Вересково-фиолетовом фоне;Честь не Ласточка;955;True;9
645;Фицкили;Пальма на Вересково-фиолетовом фоне;Слава не Антилопа;233;True;13
646;Фицдраки;Кабан на Бледно-зеленом фоне;Дорога не Лань;64;False;6
647;Санлерммы;Бык на Ализариновый красном фоне;Долг  Медведь;505;True;7
648;Брашетры;Волк на Бледный фиолетово-красном фоне;Мы  Пеликан;170;True;24
649;Вуддралоу;Оливковое дерево на Аквамариновом фоне;Мы не Медведь;796;False;21
650;Стоуншетры;Аист на Алом фоне;Слава не Утка;212;True;14
651;Бридкевны;Медведь на Бледно-синем фоне;Дорога  Овца;692;False;7
652;Блэктиглоу;Сова на Бронзовом фоне;Тихие не Страус;642;True;2
653;Вебкионы;Собака на Бледный фиолетово-красном фоне;Справедливость не Аист;492;False;22
654;Вебперхи;Страус на Бордово-фиолетовом фоне;Тихие не Лань;656;True;23
655;Фиццакли;Медведь на Бордовом фоне;Дорога не Бабочка;438;False;18
656;Браномны;Змей на Бледно-каштановом фоне;Жизнь не Павлин;336;True;13
657;Крацакды;Собака на Бледный зеленом фоне;Дорога живет Аист;10;True;19
658;Вебдраки;Змей на Бледно-пурпурном фоне;Справедливость не Грач;49;False;10
659;Санры;Журавль на Бледно-синем фоне;Дорога не Конь;989;True;7
660;Стоуншетты;Аист на Бело-алюминиевом фоне;Дорога  Пчела;716;False;22
661;Вудтигри;Кабан на Аметистовом фоне;Мы есть Медведь;976;True;23
662;Вебри;Павлин на Аспидно-сером фоне;Слава  Оливковое дерево;810;False;23
663;Гиббероны;Муравей на Бледный синем фоне;Защита есть Сова;634;False;9
664;Кракевммы;Ворон на Бледно-васильковом фоне;Громкие живет Павлин;126;True;24
665;Хоакихи;Лев на Амарантово-розовом фоне;Страх  Собака;865;False;15
666;Блэктигвеи;Попугай на Бледно-фиолетовом фоне;Тихие есть Оливковое дерево;411;True;6
667;Гибномки;Волк на Бирюзово-зеленом фоне;Честь  Сокол;76;True;7
668;Санвысты;Павлин на Белоснежном фоне;Тихие не Медведь;204;True;13
669;Стоунвеи;Лев на Бледно-пурпурном фоне;Бог живет Дуб;764;False;5
670;Ривливммы;Олень на Абрикосовом фоне;Долг живет Слон;80;True;12
671;Фицкевммы;Ворон на Бледно-пурпурном фоне;Защита есть Попугай;452;False;11
672;Хоакевды;Сова на Бледный желто-розовом фоне;Дорога  Журавль;605;True;5
673;Фицпервеи;Лань на Бледный пурпурно-розовом фоне;Слава не Волк;628;True;15
674;Вуддрахи;Пеликан на Бледно-каштановом фоне;Долг не Собака;363;True;25
675;Краномоны;Лев на Бледный желто-розовом фоне;Жизнь не Оливковое дерево;309;False;20
676;Бридцакли;Кролик на Бледно-карминном фоне;Бог  Аист;495;False;9
677;Санномры;Кабан на Бело-алюминиевом фоне;Тихие есть Страус;802;True;25
678;Блэкли;Грач на Бледно-песочном фоне;Мы не Медведь;852;True;9
679;Гиблероны;Антилопа на Амарантовый светло-вишневом фоне;Справедливость есть Павлин;418;False;6
680;Санты;Медведь на Бледный пурпурно-синем фоне;Справедливость есть Волк;603;False;9
681;Стоунвысоны;Ласточка на Бледный зеленом фоне;Страх  Слон;795;True;24
682;Кравысры;Муравей на Бледный пурпурно-синем фоне;Защита  Бык;568;True;15
683;Блэккевры;Лань на Бирюзово-синем фоне;Честь живет Бык;618;False;11
684;Брацаквеи;Аист на Бронзовом фоне;Долг есть Собака;166;True;24
685;Кракины;Слон на Бледно-зелено-сером фоне;Громкие есть Медведь;352;True;5
686;Ривливры;Ворон на Бирюзовом фоне;Защита  Оливковое дерево;489;False;20
687;Санберры;Волк на Белом фоне;Тихие живет Орёл;885;False;6
688;Кравысри;Кошка на Бледно-розоватом фоне;Справедливость  Сова;245;False;1
689;Вебдраоны;Журавль на Бледно-песочном фоне;Страх есть Сокол;921;True;16
690;Кравысды;Попугай на Бледно-фиолетовом фоне;Долг не Волк;185;False;22
691;Бридкили;Дельфин на Белоснежном фоне;Громкие живет Сова;858;False;6
692;Бридкевхи;Журавль на Амарантовый светло-вишневом фоне;Страх не Муравей;256;True;9
693;Краберты;Лев на Амарантовом фоне;Страх живет Попугай;368;True;10
694;Стоунливды;Ласточка на Базальтово-сером фоне;Тихие есть Пальма;129;True;24
695;Блэквысры;Слон на Бледно-зелено-сером фоне;Дорога не Лань;31;True;24
696;Браперны;Антилопа на Бело-алюминиевом фоне;Громкие живет Утка;470;False;10
697;Вебцакты;Утка на Бледно-зеленом фоне;Честь есть Грач;336;False;20
698;Фицкихи;Бабочка на Амарантовом фоне;Страх  Павлин;150;False;18
699;Хоаперммы;Дуб на Бледно-каштановом фоне;Честь есть Орёл;581;True;19
700;Вудперки;Сова на Алом фоне;Тихие не Конь;190;False;1
701;Санкири;Журавль на Бледный зеленом фоне;Долг не Морская раковина;171;False;19
702;Хоаномли;Сокол на Бледный серо-коричневом фоне;Жизнь есть Пальма;722;False;8
703;Браберммы;Кабан на Бирюзово-синем фоне;Справедливость живет Волк;212;False;6
704;Саншетоны;Утка на Бледный желто-зеленом фоне;Дорога не Олень;381;True;19
705;Вебномты;Журавль на Бледно-коричневом фоне;Бог не Попугай;890;True;1
706;Ривкири;Лев на Бледный пурпурно-розовом фоне;Долг  Орёл;986;True;23
707;Хоадраки;Змей на Бледно-золотистом фоне;Долг не Попугай;781;False;16
708;Блэклерммы;Бык на Болотном фоне;Жизнь есть Слон;70;False;15
709;Кралерты;Дуб на Бледный желто-розовом фоне;Справедливость  Орёл;355;False;8
710;Гибперлоу;Орёл на Ванильном фоне;Мы  Грач;734;False;18
711;Кралерды;Лев на Аспидно-сером фоне;Громкие живет Кошка;751;False;18
712;Фиццакры;Конь на Васильковом фоне;Громкие  Олень;85;False;12
713;Бридперды;Змей на Бежево-сером фоне;Тихие есть Сова;218;False;5
714;Вебшетты;Кабан на Бледный красно-пурпурном фоне;Справедливость есть Пеликан;925;True;17
715;Блэкдурвеи;Орёл на Болотном фоне;Жизнь  Конь;409;False;24
716;Фицкины;Павлин на Бледный пурпурно-синем фоне;Тихие есть Кабан;577;True;6
717;Вебдралоу;Змей на Бежево-коричневом фоне;Громкие  Павлин;948;True;17
718;Санливхи;Бабочка на Бледно-розовом фоне;Слава не Бабочка;683;True;2
719;Вудшетммы;Сокол на Бирюзовом фоне;Защита не Журавль;423;False;12
720;Бридри;Медведь на Бледно-каштановом фоне;Бог  Лебедь;286;False;4
721;Крадурны;Страус на Бледный серо-коричневом фоне;Слава  Пеликан;375;False;14
722;Браномды;Сокол на Бледный серо-коричневом фоне;Справедливость  Дуб;707;True;12
723;Ривномвеи;Волк на Амарантово-пурпурном фоне;Справедливость есть Муравей;621;False;16
724;Гибливоны;Лебедь на Бледный пурпурно-розовом фоне;Честь живет Сокол;847;True;6
725;Блэккевхи;Конь на Бледный желто-розовом фоне;Бог есть Морская раковина;206;False;5
726;Ривливты;Медведь на Бледно-васильковом фоне;Защита есть Муравей;109;False;7
727;Кракевхи;Ласточка на Алом фоне;Слава есть Собака;396;True;1
728;Хоацакхи;Бык на Бежево-коричневом фоне;Жизнь живет Конь;692;True;14
729;Вебдрали;Утка на Бледный зеленовато-желтом фоне;Дорога живет Овца;917;True;25
730;Фицкевры;Оливковое дерево на Бледно-золотистом фоне;Бог живет Пальма;593;False;17
731;Блэкномвеи;Бык на Амарантово-пурпурном фоне;Тихие  Сова;442;True;25
732;Гибцакри;Ворон на Бледно-зеленом фоне;Слава  Овца;943;True;15
733;Бридливны;Антилопа на Бледно-коричневом фоне;Мы  Змей;24;False;4
734;Бридлерхи;Кошка на Болотном фоне;Жизнь  Овца;636;False;19
735;Веблерммы;Страус на Амарантовом фоне;Мы не Пальма;466;False;17
736;Санливхи;Сокол на Белом фоне;Тихие живет Антилопа;341;False;6
737;Санберры;Орёл на Базальтово-сером фоне;Слава живет Лев;844;True;6
738;Брапервеи;Попугай на Бордово-фиолетовом фоне;Слава живет Орёл;834;False;18
739;Гибцаконы;Лань на Бледный синем фоне;Жизнь есть Аист;91;False;21
740;Стоункиты;Лань на Аспидно-синем фоне;Защита  Оливковое дерево;951;True;22
741;Вебливри;Сова на Амарантово-пурпурном фоне;Честь  Дельфин;39;False;1
742;Блэкли;Лев на Бледно-карминном фоне;Мы есть Грач;919;False;21
743;Стоункиры;Попугай на Абрикосовом фоне;Защита живет Змей;376;True;23
744;Гибномри;Лань на Бледно-пурпурном фоне;Защита живет Утка;637;True;5
745;Вебномхи;Бабочка на Бледно-песочном фоне;Тихие  Лань;973;False;3
746;Бридты;Ворон на Бледно-коричневом фоне;Честь не Попугай;278;False;3
747;Блэкцакри;Аист на Бледный зеленом фоне;Слава есть Утка;32;True;7
748;Стоункилоу;Змей на Белом фоне;Слава живет Пчела;870;True;24
749;Вудперры;Медведь на Васильковом фоне;Слава живет Слон;821;True;9
750;Бридливли;Журавль на Бледно-коричневом фоне;Мы  Страус;731;False;20
751;Вудкевты;Грач на Бежево-сером фоне;Слава живет Попугай;542;False;16
752;Хоаливды;Волк на Бледно-коричневом фоне;Справедливость есть Сова;940;True;14
753;Браперны;Пчела на Аквамариновом фоне;Жизнь не Страус;756;False;20
754;Брадраоны;Собака на Вересково-фиолетовом фоне;Тихие есть Попугай;819;True;24
755;Хоадуроны;Конь на Бриллиантово-синем фоне;Честь есть Грач;623;True;23
756;Блэкхи;Кролик на Бледный пурпурно-синем фоне;Дорога  Конь;581;False;23
757;Вуддраоны;Слон на Бледно-карминном фоне;Справедливость не Дельфин;36;False;9
758;Хоаливки;Утка на Бледно-каштановом фоне;Мы живет Олень;856;False;16
759;Санберры;Слон на Ванильном фоне;Защита живет Пальма;835;True;15
760;Ривлероны;Пчела на Бледно-зелено-сером фоне;Долг не Муравей;378;False;24
761;Бракихи;Журавль на Бордовом фоне;Жизнь есть Антилопа;78;True;17
762;Санлерды;Оливковое дерево на Амарантово-розовом фоне;Бог  Грач;745;False;17
763;Стоунливлоу;Пчела на Бледно-каштановом фоне;Дорога не Ворон;413;True;7
764;Блэкпервеи;Пеликан на Бледно-пурпурном фоне;Страх живет Бык;332;False;3
765;Вуддурвеи;Слон на Бежево-коричневом фоне;Громкие живет Волк;981;True;14
766;Бридкевхи;Оливковое дерево на Болотном фоне;Справедливость  Аист;535;True;21
767;Стоундурлоу;Пчела на Бледный желто-зеленом фоне;Бог живет Морская раковина;748;False;2
768;Хоабервеи;Змей на Абрикосовом фоне;Жизнь не Слон;204;False;23
769;Блэкдурли;Сова на Аквамариновом фоне;Долг есть Лебедь;415;False;16
770;Бридномты;Кролик на Аквамариновом фоне;Долг живет Олень;417;False;21
771;Фицномли;Орёл на Бледный пурпурно-розовом фоне;Дорога живет Пчела;904;True;6
772;Бридномммы;Попугай на Бирюзовом фоне;Страх живет Павлин;933;False;11
773;Фицтигри;Конь на Амарантовый глубоко-пурпурном фоне;Долг есть Пеликан;219;True;24
774;Ривтигвеи;Лебедь на Бордовом фоне;Жизнь  Журавль;531;False;18
775;Фицливли;Бабочка на Бледный фиолетово-красном фоне;Честь есть Дуб;404;True;9
776;Бридкеввеи;Слон на Бледно-синем фоне;Честь не Овца;961;True;11
777;Вудшетны;Пальма на Бледный фиолетово-красном фоне;Долг  Пальма;761;True;3
778;Блэккики;Кошка на Бледный желто-розовом фоне;Тихие  Кошка;646;False;25
779;Кракили;Оливковое дерево на Бриллиантово-синем фоне;Защита живет Собака;589;True;23
780;Вудцаконы;Лань на Амарантовом фоне;Тихие живет Антилопа;808;False;15
781;Вудды;Орёл на Бежевом фоне;Честь живет Олень;962;False;8
782;Сандравеи;Муравей на Бледно-песочном фоне;Мы не Лань;984;True;20
783;Хоавысды;Кролик на Амарантовый глубоко-пурпурном фоне;Страх  Конь;121;True;14
784;Вебтигммы;Дуб на Бледно-песочном фоне;Честь живет Утка;27;False;25
785;Блэкперммы;Слон на Бледно-пурпурном фоне;Тихие есть Сова;941;False;8
786;Гибберки;Лань на Бледный пурпурно-розовом фоне;Защита  Конь;604;True;17
787;Ривперры;Павлин на Бледный пурпурно-синем фоне;Справедливость живет Слон;480;True;16
788;Риври;Медведь на Бледно-коричневом фоне;Справедливость не Морская раковина;207;False;20
789;Риввысоны;Оливковое дерево на Бежево-красном фоне;Долг есть Бык;35;True;20
790;Бридтигли;Пеликан на Бело-зеленом фоне;Честь  Орёл;249;True;23
791;Бракевты;Бык на Васильковом фоне;Справедливость не Кошка;133;False;6
792;Блэкномки;Сова на Бледно-розоватом фоне;Долг есть Дуб;248;True;7
793;Ривберки;Сокол на Бледно-песочном фоне;Честь живет Аист;634;True;20
794;Вудливлоу;Журавль на Бледный пурпурно-синем фоне;Слава  Медведь;919;True;19
795;Хоавыски;Дуб на Аметистовом фоне;Тихие есть Дельфин;330;False;11
796;Гибкионы;Грач на Бирюзово-синем фоне;Честь есть Кабан;174;True;24
797;Фицливды;Попугай на Бежево-красном фоне;Жизнь есть Лебедь;510;True;15
798;Вудпероны;Муравей на Бледный зеленом фоне;Тихие  Журавль;971;False;7
799;Стоундурхи;Орёл на Бирюзово-синем фоне;Честь живет Сова;635;True;6
800;Стоундраны;Конь на Амарантовый светло-вишневом фоне;Тихие не Ворон;365;True;20
801;Санкиммы;Сова на Бледно-зелено-сером фоне;Мы живет Слон;250;False;10
802;Санкевны;Бабочка на Алом фоне;Честь живет Змей;923;True;14
803;Веблерли;Слон на Бледный синем фоне;Страх  Морская раковина;184;True;9
804;Вебвыслоу;Волк на Амарантово-розовом фоне;Страх есть Попугай;135;True;22
805;Вудлерммы;Сокол на Базальтово-сером фоне;Страх живет Олень;669;False;19
806;Стоунномны;Овца на Аквамариновом фоне;Тихие живет Олень;950;True;2
807;Крацакри;Павлин на Бледный желто-розовом фоне;Жизнь не Орёл;441;False;20
808;Гибшетммы;Кошка на Бордово-фиолетовом фоне;Тихие есть Утка;590;True;1
809;Браперры;Антилопа на Бриллиантово-синем фоне;Бог не Грач;807;False;11
810;Стоуншетвеи;Ворон на Амарантовый светло-вишневом фоне;Бог не Ласточка;620;False;21
811;Гибкири;Лебедь на Бледный желто-розовом фоне;Жизнь  Лебедь;108;False;12
812;Санномны;Волк на Бледно-песочном фоне;Долг живет Волк;589;False;8
813;Вебномхи;Журавль на Бледный зеленовато-желтом фоне;Защита не Павлин;138;False;18
814;Блэкшетки;Дуб на Васильковом фоне;Слава есть Овца;852;False;7
815;Вудкири;Дельфин на Амарантово-розовом фоне;Честь  Змей;60;False;4
816;Бридшетды;Страус на Амарантово-розовом фоне;Громкие  Морская раковина;233;False;10
817;Вебливли;Павлин на Бледно-пурпурном фоне;Защита не Сокол;19;True;2
818;Краномды;Ворон на Болотном фоне;Защита  Морская раковина;954;True;17
819;Браберры;Лев на Бело-алюминиевом фоне;Мы есть Лев;227;False;3
820;Гибкиммы;Муравей на Амарантово-розовом фоне;Громкие  Дельфин;962;False;12
821;Сандрали;Журавль на Бордовом фоне;Страх есть Овца;954;False;18
822;Стоунды;Антилопа на Аспидно-синем фоне;Бог не Грач;707;False;2
823;Стоунливвеи;Пчела на Бледный серо-коричневом фоне;Защита есть Утка;173;False;7
824;Гибливлоу;Дельфин на Бледный серо-коричневом фоне;Тихие не Грач;886;False;17
825;Стоундрары;Лебедь на Вересково-фиолетовом фоне;Тихие есть Сокол;504;True;11
826;Стоундрари;Кабан на Аметистовом фоне;Жизнь живет Змей;503;False;17
827;Хоакихи;Морская раковина на Аметистовом фоне;Мы живет Лев;961;True;11
828;Хоадурны;Овца на Вересково-фиолетовом фоне;Справедливость не Медведь;799;False;21
829;Гибкевры;Орёл на Бледно-розоватом фоне;Справедливость не Журавль;194;True;3
830;Вебкеввеи;Сова на Бледно-пурпурном фоне;Жизнь  Медведь;262;True;1
831;Вебливммы;Орёл на Бледно-синем фоне;Честь есть Пальма;656;False;19
832;Гибшетки;Пальма на Бирюзово-синем фоне;Дорога есть Дельфин;108;True;23
833;Фицны;Оливковое дерево на Бежево-красном фоне;Защита есть Журавль;945;False;6
834;Вудкевли;Конь на Амарантово-пурпурном фоне;Слава  Орёл;509;True;11
835;Хоаномлоу;Пчела на Белом фоне;Долг живет Ласточка;982;False;10
836;Хоабервеи;Аист на Бирюзово-зеленом фоне;Слава есть Лев;897;True;4
837;Ривдурвеи;Журавль на Бледно-синем фоне;Долг не Грач;67;False;9
838;Ривномны;Грач на Аспидно-сером фоне;Тихие есть Ласточка;25;False;22
839;Бридны;Бык на Бледный желто-зеленом фоне;Страх есть Сокол;613;False;8
840;Вудкихи;Сова на Бледный зеленовато-желтом фоне;Жизнь  Морская раковина;673;False;22
841;Вебри;Сокол на Бледный зеленом фоне;Защита есть Аист;321;False;2
842;Ривномвеи;Утка на Абрикосовом фоне;Жизнь не Муравей;205;True;19
843;Санцакны;Лебедь на Амарантово-розовом фоне;Мы есть Ласточка;665;True;14
844;Ривномммы;Грач на Бежевом фоне;Честь живет Кабан;413;True;14
845;Хоадраны;Морская раковина на Бронзовом фоне;Громкие  Олень;402;True;5
846;Бридвысоны;Ласточка на Аспидно-сером фоне;Жизнь не Ласточка;456;False;14
