Id_house;name;blazon;motto;followers;exist;Id_kingdom
1;Старки;Серый лютоволк на бело-зелёном фоне;«Зима близко»;91;False;1
2;Болтоны;Красный ободранный человек, распятый вни;«Наши ножи остры»;847;True;1
3;Дастины;Ржавые перекрещённые топоры на жёлтом фо;Неизвестен;126;True;1
4;Мандерли;Белый водяной с зелёными волосами на син;Не известен;785;False;1
5;Флинты;"Синее поле с белыми гребешками волн; в в";«Вечно бдительны» (согласно книгам);449;False;1
6;Гловеры;Серебряный сжатый кулак на красном фоне;Неизвестен;932;True;1
7;Сервины;Чёрный боевой топор на серебряном поле;«Заточен и готов»;547;False;1
8;Карстарки;Белая солнечная вспышка на чёрном фоне;«Солнце зимы»;43;False;1
9;Мормонты;Чёрный медведь в зеленых лесах;«Мы здесь стоим»;641;False;1
10;Амберы;Две скрещённые серебряные цепи на красно;Не известен;800;True;1
11;Рисвеллы;Чёрная голова лошади с красными глазами ;Не известен;310;False;1
12;Риды;Чёрная ящерица на серо-зелёном фоне;Неизвестен;643;False;1
13;Локи;Два скрещённых бронзовых ключа над белым;Не известен;322;False;1
14;Толхарты;Три зелёных ели на коричневом фоне;«Горды и свободны»;329;True;1
15;Хорнвуды;Чёрная голова лося на оранжевом фоне;«Правый в гневе»;441;False;1
16;Пули;Синяя тарелка на белом фоне с серой внут;Не известен;159;True;1
17;Гринлифы;Не известен;Не известен;566;False;1
18;Кассели;Десять белых голов волков на сером фоне ;Не известен;267;False;1
19;Мейзины;Желтые круги на бело-синем клетчатом фон;Неизвестно;409;True;1
20;Моллены;Сосна, покрытая снегом, на бледно-зелёно;Не известен;976;True;2
21;Форрестеры;Белое дерево с силуэтом меча на чёрном ф;«Железо изо льда»;466;False;1
22;Дормунды;Не известен;Не известен;560;False;1
23;Гленморы;Натянутый лук и стрела;Не известен;730;False;1
24;Уэллсы;Не известен;Агыбай батыр всегда !;934;False;1
25;Марши;Десять лягушек на жёлтом фоне;Не известен;682;True;1
26;Уайтхиллы;Белый перевернутый клин на фоне цвета ин;Не известен;178;True;1
27;Холты;Не известен;Не известен;638;True;1
28;Браунбэрроу;Не известен;Не известен;820;True;1
29;Грейсоны;Не известен;Не известен;58;True;1
30;Тауэрсы;Пять башен, обрамленных двойной красной ;Неизвестен;889;False;6
31;Элливеры;Не известен;Не известен;779;True;1
32;Эмберы;Не известен;Не известен;599;False;1
33;Фросты;Не известен;Не известен;881;True;1
34;Талли;Прыгающая серебряная форель среди красно;«Семья, долг, честь»;233;False;6
35;Блэквуды;Стая чёрных воронов, которые кружатся на;Неизвестен;716;True;6
36;Бракены;Красный жеребец на золотом фоне;Неизвестен;344;False;6
37;Маллистеры;Серебряный орёл на синем фоне;«Над остальными»;98;True;6
38;Мутоны;Красный лосось на белом фоне с золотой к;«Мудрость и сила»;330;False;6
39;Смоллвуды;Шесть коричневых желудей на желтом фоне;«С этого начинается»;961;True;6
40;Фреи;Две башни Близнецов и мост между ними на;«Стоим плечом к плечу»;937;False;6
41;Уоды;Три белых ежа на жёлтом фоне;«Не прикасайся ко мне!»;419;True;6
42;Хеддли;Неизвестен;Неизвестен;12;True;6
43;Хэи;Чёрные вилы на золотой косой полосе, изо;Неизвестно;779;False;6
44;Эренфорды;Золотая цапля с черными ногами сжимает ч;Неизвестен;121;True;6
45;Бейлиши;Чёрный пересмешник на жёлтом фонеГолова ;Не известен;617;True;6
46;Дарри;Чёрный пахарь на коричневом поле;Неизвестен;162;False;6
47;Джастмены;Золотые весы на белой поле с двойной син;Не известен;594;True;6
48;Квохерисы;Пылающий красно-жёлтый косой крест и чет;Неизвестен;445;True;6
49;Лотстоны;Черная летучая мышь на скошенном справа ;Неизвестен;281;True;6
50;Мадды;Золотой венец, инкрустированный изумруда;Неизвестен;273;False;6
51;Стронги;Три полосы синего, красного и зеленого ц;Неизвестен;256;True;6
52;Уэнты;Девять летучих мышей на оранжевом фоне;Неизвестен;88;False;6
53;Харровеи;Линия в виде языков пламени и замок на о;Неизвестен;47;False;6
54;Аррены;Белый летящий сокол и месяц на синем фон;«Высокий как честь»;14;False;5
55;Белморы;Шесть белых колокольчиков на пурпурном ф;Неизвестен;141;False;5
56;Игены;Жёлтое солнце, белый полумесяц и серебря;«И днём, и ночью»;964;True;5
57;Корбреи;Три ворона, несущий красное сердце в ког;Неизвестен;889;True;5
58;Линдерли;Зелёные змеи на чёрном фоне;Не известен;694;False;5
59;Ройсы;Галька на оранжевом фоне, окружённая рун;«Мы помним»;169;True;5
60;Толлетты;Серые и чёрные клинья;«В самый тёмный час»;592;True;5
61;Уэйнвуды;Чёрное сломанное колесо на зелёном фоне;Не известен;231;True;5
62;Хантеры;Пять серебряных стрел веером на коричнев;Не известен;459;True;5
63;Муры;Три бронзовых наконечника для копий на б;Неизвестен;102;True;5
64;Ланнистеры;Золотой лев, стоящий на задних лапах, на;«Услышь мой рёв!»«Ланнистеры всегда плат;397;False;2
65;Вестерлинги;Шесть белых ракушек на песчанном фоне;«Честь, а не почесть»;875;False;2
66;Крейкхоллы;Белый боров на оранжевом фоне;«Нет таких свирепых»;812;True;2
67;Ланнистеры из Ланниспорта;Золотой лев, стоящий на задних лапах, на;«Услышь мой рёв!»«Ланнистеры всегда плат;722;False;2
68;Леффорды;Золотое остриё на лазурном, справа солнц;Не известен;481;False;2
69;Марбранды;Дерево, горящее оранжевым пламенем на се;«Ярче гори!»;232;True;2
70;Пейны;Фиолетовые и белые клетки с золотыми мон;Не известен;90;False;2
71;Сарсфилды;Зеленая стрела над белой правой перевязь;«Правда метит»;649;False;2
72;Серретты;Павлин с распущенным хвостом на бежевом ;«У меня нет соперников»;780;True;2
73;Ярвики;Две бронзовые скрещенные алебарды между ;Не известен;843;True;2
74;Гринфилды;Двойная белая кайма по краю на зеленом ф;Не известен;702;False;2
75;Лорхи;Чёрная мантикора на белом фоне под тремя;Неизвестен;436;False;2
76;Свифты;Синий петух на жёлтом фоне;«Пробудитесь! Пробудитесь!»;189;False;2
77;Хезерспуны;Деревянная ложка на белом картуше, распо;Не известен;524;False;2
78;Кастерли;Не известен;Не известен;243;False;21
79;Клиганы;Три чёрных собаки на жёлтом фоне;Не известен;349;True;2
80;Рейны;Красный лев на серебряном фоне;Не известен;929;True;2
81;Тарбеки;Сине-белая семиконечная звезда на синем ;Не известен;537;False;2
82;Блаунты;Красная правая перевязь между двумя чёрн;Неизвестен;358;True;8
83;Брюны;Коричневая медвежья лапа на белом фоне с;Неизвестен;252;True;8
84;Гонты;Три чёрные направленные вверх пики на ро;Неизвестен;126;False;8
85;Кеттлблэки;Чёрный котёл на красном фоне с тонкой от;Неизвестен;93;True;8
86;Риккеры;Два скрещенных боевых молота над белым а;Неизвестен;196;False;8
87;Росби (дом);Три красных шеврона на мехе горностая;Неизвестен;403;False;8
88;Слинты;Окровавленное золотое копьё на чёрном фо;Неизвестен;510;False;8
89;Стокворты;Белый ягненок, держащий передней ногой з;«Гордимся преданностью»;236;True;8
90;Стонтоны;Два чёрных крыла на белой полосе через ч;Неизвестен;638;False;8
91;Торны;Кистень на алом поле;Неизвестен;594;True;8
92;Челстеды;Перекрещенные шипастая булава и серебрян;Неизвестен;560;False;8
93;Бар-Эммоны;Синяя рыба-меч на пересекающимися серебр;Неизвестен;440;False;8
94;Веларионы;Серебряный морской конь на фоне цвета мо;Не известен;889;True;8
95;Селтигары;Пять красных крабов на белом фоне с крас;Неизвестен;217;True;8
96;Таргариены;Трёхглавый дракон красного цвета на чёрн;«Пламя и кровь»;502;True;8
97;Блэкфайры;Чёрный трехглавый дракон на красном фоне;Неизвестен;28;True;8
98;Дарклины;В правой части семь белых щитов на красн;Неизвестен;246;True;8
99;Каргиллы;Золотой гусь на поле в кроваво-красную и;Неизвестен;561;False;8
100;Холларды;Красные и розовые горизонтальные полосы,;Неизвестен;788;True;8
101;Баратеоны из Королевской Гавани;Слева чёрный коронованный олень Баратеон;Не известен;278;True;8
102;Баратеоны из Драконьего Камня;Коронованный чёрный олень на горящем кра;«Нам — ярость»;48;False;8
103;Баратеоны;Черный коронованный олень, стоящий на за;«Нам — ярость»;403;False;7
104;Баклеры;Три бронзовые пряжки на синем фоне;Не известен;179;True;7
105;Грандисоны;Спящий чёрный лев на жёлтом фоне;«Не буди меня!»;738;True;7
106;Масгуды;Щит разделён на четыре части: в двух чет;Неизвестен;951;False;7
107;Морригены;Чёрная ворона в полёте на тёмно-зелёном ;Неизвестен;922;True;7
108;Пенрозы;Два белых скрещённых пера на буром фоне;«Запишем наши деяния»;737;True;7
109;Пизбери;Вскрытый зелёный гороховый стручок на бе;Неизвестен;128;False;7
110;Тарты;Жёлтые солнца на розовом и белые месяцы ;Неизвестен;688;False;7
111;Трэнты;Чёрный висельник на синем фоне;«Так заканчивают наши враги»;798;False;7
112;Уайлды;Сине-зелёный водоворот на золотом поле;Неизвестен;450;True;7
113;Эрролы;Стог сена на оранжевом фоне;Неизвестен;444;True;7
114;Эстермонты;Тёмно-зелёная черепаха на бледно-зелёено;Неизвестен;19;False;7
115;Дондаррионы;Раздвоенная пурпурная молния на чёрном ф;Не известен;124;False;7
116;Кароны;Чёрные соловьи на жёлтом фоне;«Нет песни слаще»;193;True;7
117;Сванны;Чёрный лебедь на белом фоне и белый лебе;Неизвестен;444;False;7
118;Селми;Три жёлтых пшеничных колоса на тёмно-кор;Неизвестен;53;True;7
119;Коннингтоны;Поле, разделённое вертикально на две час;«Мы — буря»;394;False;7
120;Сиворты;Чёрный корабль на бледно-сером фоне с бе;Неизвестен;488;False;7
121;Дюррандоны;Чёрный олень на золотом фоне;«Нам — ярость»;980;True;7
122;Коли;Десять чёрных шаров, расположенных на кр;Не известен;225;True;7
123;Тойны;Чёрное крылатое сердце на золотом фоне с;«Летать высоко, летать далеко»;862;False;7
124;Дом Бронна;Пылающая стрела на сером фоне;Не известен;499;True;4
125;Тиреллы;Золотая роза на зеленом поле;«Вырастая — крепнем»;81;True;4
126;Гарденеры;Зеленая рука на белом фоне;Не известен;698;False;4
127;Бисбери;Жёлтый пчелиный улей на чёрном фоне;«Берегитесь нашего жала»;555;False;4
128;Бранфилды;Не известен;Не известен;312;False;21
129;Булверы;Белый бычий череп на красном фоне;«Лучше смерть, чем бесчестье»;791;True;4
130;Вебберы;Красно-белый паук на серебряной паутине,;Неизвестен;336;False;4
131;Дурвеллы;Не известен;Не известен;145;False;4
132;Инчфилды;Перевязь в чёрно-белую клетку на сером ф;Неизвестен;319;True;4
133;Костейны;Щит разделённый на четыре части с серебр;Не известен;818;False;4
134;Кью;Шесть желтых цветов на синем фоне;Не известен;386;False;4
135;Лейгуды;Три чёрных молнии на оранжевом фоне;Не известен;462;False;4
136;Маллендоры;Чёрно-оранжевые бабочки на белом фоне;Не известен;962;True;4
137;Мерривезеры;Золотой рог с которого вываливаются фрук;«Узрите нашу щедрость»;628;False;4
138;Окхарты;Три дубовых листа на желтом фоне;«Наши корни уходят глубоко»;762;False;4
139;Осгреи;Лев в зелёно-золотую клетку на белом фон;Неизвестен;303;False;4
140;Редвины;Гроздья винограда на белом фоне;Неизвестен;506;True;4
141;Рованы;Золотое дерево на серебряном фоне;Неизвестен;116;False;4
142;Стрикленды;Неизвестен;Неизвестен;361;True;4
143;Тарли;Охотник в красном, натягивающий тетиву л;«Первые в битве»;797;False;4
144;Флоренты;Лиса на горностаевом мехе;Неизвестен;798;False;4
145;Фоссовеи;Красное яблоко на золотом фоне;«Вкус славы»;591;True;4
146;Хайтауэры;Белая каменная башня с огнём на вершине;«Мы освещаем путь»;354;True;4
147;Хаствики;Полосы оливкого цвета и цвета слоновой к;«Никто так не предан долгу»;541;False;4
148;Эшфорды;Белое солнце под белым шевроном на оранж;"""Наше солнце светит ярко""";519;False;4
149;Мартеллы;Красное солнце, пронзённое золотым копьё;«Непреклонные, несгибаемые, несдающиеся»;932;True;3
150;Айронвуды;Чёрная герса на песчаном поле;«Мы охраняем путь»;902;False;3
151;Аллирионы;Золотая рука на красно-чёрном клинчатом ;«Враг не пройдет»;501;True;3
152;Блэкмонты;Серый стервятник с младенцем в когтях на;Неизвестен;992;True;3
153;Гаргалены;Красный василиск с чёрной змеей в клюве ;Неизвестен;425;True;3
154;Дальты;Дикие лимоны на пурпурном поле;Неизвестен;378;False;3
155;Дейны;Чёрный меч и белая падающая звезда на си;Неизвестен;719;False;3
156;Джордейны;Золотое перо на шахматном поле с тёмно- ;«Да будет написано»;510;True;3
157;Драйленды;Неизвестен;Неизвестен;136;True;3
158;Кворгилы;Три чёрных скорпиона на красном поле;Неизвестен;667;False;3
159;Манвуди;Белый коронованный череп на чёрном поле;Неизвестен;990;True;3
160;Сантагары;Пятнистый леопард с золотым топором на б;Неизвестен;47;False;3
161;Уллеры;Пламеневидное пересечение желтого и крас;Неизвестен;598;False;3
162;Фаулеры;Синий ястреб в клобучке на серебряном фо;«Воспарим!»;906;True;3
163;Грейджои;Золотой кракен на чёрном фоне;«Мы не сеем»;903;True;9
164;Хоары;Корабль, ель, виноград и ворон, между ни;Не известен;471;False;9
165;Блектайды;Не известен;Не известен;682;False;21
166;Ботли;Косяк серебряной рыбы на светло-зелёном ;Не известен;764;False;9
167;Гудбрайзеры;Не известен;Не известен;233;True;21
168;Драммы;Белая костяная рука на красном поле;Не известен;849;True;9
169;Кеннинги;Не известен;Не известен;697;False;9
170;Мерлины;Два закрученных зелёных водяных торнадо ;Не известен;81;False;9
171;Хамблы;Не известен;Не известен;281;False;9
172;Харлоу;Серебряная коса на чёрном фоне;Не известен;830;True;9
173;Блекброу;Не известен;Не известен;317;True;21
174;Колфилды;Не известен;Не известен;361;False;21
175;Ранкенфеллы;Не известен;Не известен;964;True;21
176;Уибберли;Не известен;Не известен;769;True;21
177;Браномты;Муравей на Бирюзово-синем фоне;Дорога живет Слон;518;True;15
178;Стоунвысммы;Змей на Бледно-пурпурном фоне;Дорога есть Ласточка;197;False;22
179;Фицкири;Павлин на Бордовом фоне;Жизнь не Журавль;617;False;7
180;Бридкевхи;Лев на Бледный зеленовато-желтом фоне;Тихие живет Кабан;607;True;24
181;Бракевры;Сова на Васильковом фоне;Жизнь есть Антилопа;67;False;6
182;Кравысны;Антилопа на Бледный красно-пурпурном фоне;Честь не Грач;595;True;18
183;Гибцакты;Попугай на Алом фоне;Защита не Медведь;80;True;10
184;Хоадраки;Журавль на Бледно-карминном фоне;Слава  Грач;359;False;18
185;Блэкберммы;Пеликан на Бежево-сером фоне;Громкие живет Журавль;789;True;10
186;Фицтигоны;Журавль на Аквамариновом фоне;Дорога  Пеликан;473;False;25
187;Гибномлоу;Слон на Базальтово-сером фоне;Мы не Сова;856;True;24
188;Блэктигды;Сокол на Бледно-фиолетовом фоне;Справедливость  Сокол;858;True;19
189;Веблерки;Аист на Алом фоне;Долг  Сова;90;True;25
190;Гибномлоу;Слон на Белом фоне;Мы живет Морская раковина;156;True;20
191;Сандраоны;Антилопа на Аметистовом фоне;Честь живет Дуб;690;False;3
192;Краберли;Утка на Бледный желто-розовом фоне;Честь  Аист;824;True;7
193;Гибцакммы;Дельфин на Бледный пурпурно-синем фоне;Бог  Кролик;813;True;17
194;Вудвеи;Собака на Амарантово-пурпурном фоне;Жизнь не Медведь;354;True;6
195;Хоавысхи;Кролик на Бежевом фоне;Слава живет Бык;876;False;16
196;Сантиглоу;Лев на Бледный красно-пурпурном фоне;Жизнь есть Олень;88;True;9
197;Бридлерммы;Муравей на Алом фоне;Тихие живет Олень;513;True;25
198;Ривлерммы;Аист на Аспидно-синем фоне;Бог живет Сова;128;True;20
199;Бридлоу;Журавль на Бледный серо-коричневом фоне;Тихие  Пеликан;692;True;9
200;Вебшетри;Ласточка на Бордовом фоне;Громкие живет Бык;540;True;13
201;Гибцакты;Пальма на Бледный фиолетово-красном фоне;Бог не Морская раковина;22;True;16
202;Бридкеври;Попугай на Бледно-фиолетовом фоне;Громкие не Кролик;418;False;10
203;Гибтигты;Лев на Амарантово-розовом фоне;Громкие не Дельфин;651;True;8
204;Бридномры;Олень на Бледный пурпурно-розовом фоне;Слава  Аист;302;True;1
205;Бридлероны;Бык на Болотном фоне;Слава  Ворон;765;False;5
206;Ривномры;Попугай на Бело-зеленом фоне;Защита не Орёл;514;True;6
207;Бриддраки;Грач на Бордовом фоне;Страх есть Бабочка;224;False;6
208;Вебперты;Лебедь на Бело-алюминиевом фоне;Справедливость  Страус;575;True;7
209;Бридды;Сокол на Аспидно-синем фоне;Громкие не Пчела;649;False;21
210;Ривберли;Бабочка на Бледно-желтом фоне;Слава есть Дуб;163;False;3
211;Фицкевты;Орёл на Ализариновый красном фоне;Мы живет Пеликан;603;False;6
212;Гибливки;Волк на Бледный зеленовато-желтом фоне;Защита не Волк;552;False;3
213;Блэкдрали;Страус на Бледно-золотистом фоне;Честь живет Павлин;26;True;13
